{
  "slide_index": 1,
  "title": "新能源接入能力",
  "subtitle": "测量示例",
  "section": "研究背景",
  "canvas_width_px": 1440,
  "canvas_height_px": 1080,
  "slide_width_in": 10,
  "slide_height_in": 7.5,
  "elements": [
    {
      "id": "title-1",
      "type": "title",
      "text": "新能源接入能力",
      "x": 60,
      "y": 90,
      "w": 1120,
      "h": 66,
      "font": "Microsoft YaHei",
      "font_size": 28,
      "bold": true,
      "italic": false,
      "color": "#0756A6",
      "fill": null,
      "line": null,
      "radius": 0,
      "align": "left",
      "vertical_align": "middle",
      "z_order": 10,
      "editable": true,
      "asset_source": null,
      "reproduction_strategy": "native-text"
    },
    {
      "id": "icon-1",
      "type": "icon",
      "text": "",
      "x": 80,
      "y": 250,
      "w": 96,
      "h": 96,
      "font": "",
      "font_size": 0,
      "bold": false,
      "italic": false,
      "color": "#0874D1",
      "fill": null,
      "line": null,
      "radius": 0,
      "align": "center",
      "vertical_align": "middle",
      "z_order": 9,
      "editable": false,
      "asset_source": "allowlist:solar-panel",
      "reproduction_strategy": "local-svg"
    }
  ]
}
